{
  "eventId": "44444444-4444-4444-8444-444444444444",
  "eventType": "ExchangeRateUpdated",
  "schemaVersion": 1,
  "occurredAt": "2026-09-28T18:00:00Z",
  "payload": {
    "transactionId": "33333333-3333-4333-8333-333333333333",
    "baseCurrency": "PIGGY",
    "quoteCurrency": "USD",
    "rate": "25.000",
    "quantity": 1
  }
}
